{
  "schemaVersion": 1,
  "schemaPath": "docsfn/scripts/release-gate-summary.schema.json",
  "generatedAt": "2026-10-18T17:48:56.838Z",
  "docsfnRoot": "docsfn",
  "repoRoot": ".",
  "status": "PASS",
  "code": "OK",
  "bootstrap": {
    "cleanCheckoutCommands": [
      "npm ci",
      "node docsfn/scripts/release-preflight.mjs",
      "node docsfn/scripts/release-gate.mjs"
    ]
  },
  "artifacts": {
    "summaryPath": "docsfn/.tmp/release-gate/summary.json",
    "migrationSummaryPath": "docsfn/.tmp/migration-check/summary.json"
  },
  "steps": [
    {
      "id": "preflight",
      "status": "PASS",
      "code": "OK",
      "detail": "0 failing bootstrap checks",
      "commands": [
        "node docsfn/scripts/release-preflight.mjs"
      ]
    },
    {
      "id": "docs-contract",
      "status": "PASS",
      "code": "OK",
      "detail": "0 docs contract violation(s)",
      "commands": [
        "node docsfn/scripts/docs-contract-check.mjs"
      ]
    },
    {
      "id": "shared-search-runtime-builds",
      "status": "PASS",
      "code": null,
      "detail": "built 5 shared search runtime packages",
      "commands": [
        "npm --prefix /Volumes/OS/private/tmp/pr133-validation-l5q1px7k/repo/searchfn/core run build",
        "npm --prefix /Volumes/OS/private/tmp/pr133-validation-l5q1px7k/repo/searchfn/adapter-contracts run build",
        "npm --prefix /Volumes/OS/private/tmp/pr133-validation-l5q1px7k/repo/searchfn/adapter-memory run build",
        "npm --prefix /Volumes/OS/private/tmp/pr133-validation-l5q1px7k/repo/searchfn/adapter-indexeddb run build",
        "npm --prefix /Volumes/OS/private/tmp/pr133-validation-l5q1px7k/repo/searchfn/client run build"
      ]
    },
    {
      "id": "shared-content-runtime-builds",
      "status": "PASS",
      "code": null,
      "detail": "built 8 shared content runtime packages",
      "commands": [
        "npm --prefix /Volumes/OS/private/tmp/pr133-validation-l5q1px7k/repo/mdfn/core run build",
        "npm --prefix /Volumes/OS/private/tmp/pr133-validation-l5q1px7k/repo/mdfn/extensions run build",
        "npm --prefix /Volumes/OS/private/tmp/pr133-validation-l5q1px7k/repo/mdfn/markdown run build",
        "npm --prefix /Volumes/OS/private/tmp/pr133-validation-l5q1px7k/repo/mdfn/render run build",
        "npm --prefix /Volumes/OS/private/tmp/pr133-validation-l5q1px7k/repo/uifn/core run build",
        "npm --prefix /Volumes/OS/private/tmp/pr133-validation-l5q1px7k/repo/uifn/dom run build",
        "npm --prefix /Volumes/OS/private/tmp/pr133-validation-l5q1px7k/repo/uifn/adapter-kit run build",
        "npm --prefix /Volumes/OS/private/tmp/pr133-validation-l5q1px7k/repo/uifn/svelte run build"
      ]
    },
    {
      "id": "package-builds",
      "status": "PASS",
      "code": null,
      "detail": "built 10 docsfn packages",
      "commands": [
        "npm --prefix /Volumes/OS/private/tmp/pr133-validation-l5q1px7k/repo/mcpfn/core run build",
        "npm --prefix /Volumes/OS/private/tmp/pr133-validation-l5q1px7k/repo/packages/admin run build",
        "npm --prefix /Volumes/OS/private/tmp/pr133-validation-l5q1px7k/repo/docsfn/core run build",
        "npm --prefix /Volumes/OS/private/tmp/pr133-validation-l5q1px7k/repo/docsfn/provider-fs run build",
        "npm --prefix /Volumes/OS/private/tmp/pr133-validation-l5q1px7k/repo/docsfn/react run build",
        "npm --prefix /Volumes/OS/private/tmp/pr133-validation-l5q1px7k/repo/docsfn/svelte run build",
        "npm --prefix /Volumes/OS/private/tmp/pr133-validation-l5q1px7k/repo/docsfn/next run build",
        "npm --prefix /Volumes/OS/private/tmp/pr133-validation-l5q1px7k/repo/docsfn/sveltekit run build",
        "npm --prefix /Volumes/OS/private/tmp/pr133-validation-l5q1px7k/repo/docsfn/cli run build",
        "npm --prefix /Volumes/OS/private/tmp/pr133-validation-l5q1px7k/repo/docsfn/admin run build"
      ]
    },
    {
      "id": "package-metadata",
      "status": "PASS",
      "code": null,
      "detail": "package metadata and built artifacts verified",
      "commands": []
    },
    {
      "id": "tests",
      "status": "PASS",
      "code": null,
      "detail": "executed 8 parity and runtime test commands",
      "commands": [
        "npm --prefix /Volumes/OS/private/tmp/pr133-validation-l5q1px7k/repo/docsfn/core run test -- --run",
        "npm --prefix /Volumes/OS/private/tmp/pr133-validation-l5q1px7k/repo/docsfn/provider-fs run test -- --run",
        "npm --prefix /Volumes/OS/private/tmp/pr133-validation-l5q1px7k/repo/docsfn/admin run test -- --run",
        "npm --prefix /Volumes/OS/private/tmp/pr133-validation-l5q1px7k/repo/docsfn/admin run typecheck",
        "npm --prefix /Volumes/OS/private/tmp/pr133-validation-l5q1px7k/repo/docsfn/react run test -- --run src/DocsContent.test.tsx src/DocsSearch.test.tsx src/Pagination.test.tsx src/ApiReferenceRenderer.test.tsx",
        "npm exec -- vitest run docsfn/svelte/src/DocsContent.test.ts docsfn/svelte/src/ApiReferenceRenderer.test.ts",
        "npm exec -- vitest --config docsfn/sveltekit/vitest.config.ts run src/route-helpers.test.ts",
        "npm --prefix /Volumes/OS/private/tmp/pr133-validation-l5q1px7k/repo/searchfn/client run test -- --run __tests__/in-memory-search.test.ts __tests__/constructors.test.ts __tests__/legacy-guard.test.ts"
      ]
    },
    {
      "id": "dogfood-site",
      "status": "PASS",
      "code": null,
      "detail": "dogfood site tests and build passed",
      "commands": [
        "npm --prefix /Volumes/OS/private/tmp/pr133-validation-l5q1px7k/repo/docsfn/docs run test -- --run src/lib/server/docs-site-source.test.ts",
        "npm --prefix /Volumes/OS/private/tmp/pr133-validation-l5q1px7k/repo/docsfn/docs run build"
      ]
    },
    {
      "id": "fixture-builds",
      "status": "PASS",
      "code": null,
      "detail": "canonical fixtures validated and built",
      "commands": [
        "node /Volumes/OS/private/tmp/pr133-validation-l5q1px7k/repo/docsfn/cli/dist/index.js validate --root /Volumes/OS/private/tmp/pr133-validation-l5q1px7k/repo/docsfn/test-fixtures/repo/datafn-docs",
        "node /Volumes/OS/private/tmp/pr133-validation-l5q1px7k/repo/docsfn/cli/dist/index.js validate --root /Volumes/OS/private/tmp/pr133-validation-l5q1px7k/repo/docsfn/test-fixtures/repo/searchfn-docs",
        "node /Volumes/OS/private/tmp/pr133-validation-l5q1px7k/repo/docsfn/cli/dist/index.js build --root /Volumes/OS/private/tmp/pr133-validation-l5q1px7k/repo/docsfn/test-fixtures/repo/datafn-docs --out-dir /Volumes/OS/private/tmp/pr133-validation-l5q1px7k/repo/docsfn/.tmp/release-gate/datafn-default",
        "node /Volumes/OS/private/tmp/pr133-validation-l5q1px7k/repo/docsfn/cli/dist/index.js build --root /Volumes/OS/private/tmp/pr133-validation-l5q1px7k/repo/docsfn/test-fixtures/repo/searchfn-docs --out-dir /Volumes/OS/private/tmp/pr133-validation-l5q1px7k/repo/docsfn/.tmp/release-gate/searchfn-default"
      ]
    },
    {
      "id": "example-tests",
      "status": "PASS",
      "code": null,
      "detail": "example proof-route test suites passed",
      "commands": [
        "npm --prefix /Volumes/OS/private/tmp/pr133-validation-l5q1px7k/repo/docsfn/examples/next-docs-site run test -- --run",
        "npm --prefix /Volumes/OS/private/tmp/pr133-validation-l5q1px7k/repo/docsfn/examples/sveltekit-docs-site run test -- --run"
      ]
    },
    {
      "id": "example-builds",
      "status": "PASS",
      "code": null,
      "detail": "Next and SvelteKit example builds passed for both canonical fixtures",
      "commands": [
        "npm --prefix /Volumes/OS/private/tmp/pr133-validation-l5q1px7k/repo/docsfn/examples/sveltekit-hybrid-site run build",
        "npm --prefix /Volumes/OS/private/tmp/pr133-validation-l5q1px7k/repo/docsfn/examples/next-docs-site run build",
        "npm --prefix /Volumes/OS/private/tmp/pr133-validation-l5q1px7k/repo/docsfn/examples/next-docs-site run build",
        "npm --prefix /Volumes/OS/private/tmp/pr133-validation-l5q1px7k/repo/docsfn/examples/sveltekit-docs-site run build",
        "npm --prefix /Volumes/OS/private/tmp/pr133-validation-l5q1px7k/repo/docsfn/examples/sveltekit-docs-site run build"
      ]
    },
    {
      "id": "migration-check",
      "status": "PASS",
      "code": "OK",
      "detail": "verified 8 proof routes across 2 fixtures",
      "commands": [
        "node docsfn/scripts/migration-check.mjs"
      ]
    }
  ],
  "checks": {
    "preflight": {
      "code": "OK",
      "suggestedBootstrap": "npm ci",
      "checks": [
        {
          "id": "node-version",
          "ok": true,
          "detail": "node v22.22.1 satisfies >=18.17.0",
          "fix": null
        },
        {
          "id": "npm-version",
          "ok": true,
          "detail": "npm 10.9.4 satisfies npm@10.2.0",
          "fix": null
        },
        {
          "id": "repo-package-json",
          "ok": true,
          "detail": "repo package.json found at /Volumes/OS/private/tmp/pr133-validation-l5q1px7k/repo/package.json",
          "fix": null
        },
        {
          "id": "repo-node-modules",
          "ok": true,
          "detail": "repo node_modules found at /Volumes/OS/private/tmp/pr133-validation-l5q1px7k/repo/node_modules",
          "fix": null
        },
        {
          "id": "docsfn-cli-bin",
          "ok": true,
          "detail": "docsfn CLI source entrypoint found at /Volumes/OS/private/tmp/pr133-validation-l5q1px7k/repo/docsfn/cli/src/index.ts",
          "fix": null
        },
        {
          "id": "canonical-fixture-datafn",
          "ok": true,
          "detail": "datafn canonical fixture root found at /Volumes/OS/private/tmp/pr133-validation-l5q1px7k/repo/docsfn/test-fixtures/repo/datafn-docs",
          "fix": null
        },
        {
          "id": "canonical-fixture-searchfn",
          "ok": true,